{
  "$schema": "https://json-schema.org/draft/2020-12/schema",
  "$id": "urn:keycloak-nats:event-filter:v1",
  "title": "Keycloak capture and publication policy",
  "type": "object",
  "required": [
    "userEvents",
    "adminEvents"
  ],
  "properties": {
    "realmIds": {
      "$ref": "#/$defs/identifiers"
    },
    "clientIds": {
      "$ref": "#/$defs/identifiers",
      "description": "Public Keycloak client IDs, including the acting client for admin events; not internal client UUIDs."
    },
    "outcomes": {
      "$ref": "#/$defs/outcomes"
    },
    "subjects": {
      "$ref": "#/$defs/subjects"
    },
    "userEvents": {
      "$ref": "#/$defs/eventTypes"
    },
    "adminEvents": {
      "type": "array",
      "items": {
        "$ref": "#/$defs/adminRule"
      }
    },
    "delivery": {
      "type": "object",
      "required": [
        "rules"
      ],
      "properties": {
        "rules": {
          "type": "array",
          "items": {
            "$ref": "#/$defs/deliveryRule"
          }
        }
      },
      "additionalProperties": false
    }
  },
  "additionalProperties": false,
  "$comment": "The parser also rejects duplicate JSON fields, duplicate rule IDs, trailing documents and non-integer JSON number tokens. JSON Schema cannot express those raw-document and cross-item constraints.",
  "$defs": {
    "identifiers": {
      "type": "array",
      "uniqueItems": true,
      "items": {
        "type": "string",
        "pattern": "[^\\u0009-\\u000d\\u001c-\\u0020\\u1680\\u2000-\\u2006\\u2008-\\u200a\\u2028\\u2029\\u205f\\u3000]"
      },
      "allOf": [
        {
          "if": {
            "contains": {
              "const": "*"
            }
          },
          "then": {
            "maxItems": 1
          }
        }
      ]
    },
    "outcomes": {
      "type": "array",
      "uniqueItems": true,
      "items": {
        "enum": [
          "*",
          "success",
          "error"
        ]
      },
      "allOf": [
        {
          "if": {
            "contains": {
              "const": "*"
            }
          },
          "then": {
            "maxItems": 1
          }
        }
      ]
    },
    "subjects": {
      "type": "array",
      "uniqueItems": true,
      "items": {
        "type": "string",
        "minLength": 1,
        "maxLength": 512,
        "pattern": "^(?:(?:[^.*>\\u0009-\\u000d\\u001c-\\u0020\\u1680\\u2000-\\u2006\\u2008-\\u200a\\u2028\\u2029\\u205f\\u3000\\u0000-\\u001f\\u007f-\\u009f]+|\\*)\\.)*(?:[^.*>\\u0009-\\u000d\\u001c-\\u0020\\u1680\\u2000-\\u2006\\u2008-\\u200a\\u2028\\u2029\\u205f\\u3000\\u0000-\\u001f\\u007f-\\u009f]+|\\*|>)(?![\\s\\S])"
      }
    },
    "eventTypes": {
      "type": "array",
      "uniqueItems": true,
      "items": {
        "enum": [
          "*",
          "LOGIN",
          "LOGIN_ERROR",
          "REGISTER",
          "REGISTER_ERROR",
          "LOGOUT",
          "LOGOUT_ERROR",
          "CODE_TO_TOKEN",
          "CODE_TO_TOKEN_ERROR",
          "CLIENT_LOGIN",
          "CLIENT_LOGIN_ERROR",
          "REFRESH_TOKEN",
          "REFRESH_TOKEN_ERROR",
          "VALIDATE_ACCESS_TOKEN",
          "VALIDATE_ACCESS_TOKEN_ERROR",
          "INTROSPECT_TOKEN",
          "INTROSPECT_TOKEN_ERROR",
          "FEDERATED_IDENTITY_LINK",
          "FEDERATED_IDENTITY_LINK_ERROR",
          "REMOVE_FEDERATED_IDENTITY",
          "REMOVE_FEDERATED_IDENTITY_ERROR",
          "UPDATE_EMAIL",
          "UPDATE_EMAIL_ERROR",
          "UPDATE_PROFILE",
          "UPDATE_PROFILE_ERROR",
          "UPDATE_PASSWORD",
          "UPDATE_PASSWORD_ERROR",
          "UPDATE_TOTP",
          "UPDATE_TOTP_ERROR",
          "VERIFY_EMAIL",
          "VERIFY_EMAIL_ERROR",
          "VERIFY_PROFILE",
          "VERIFY_PROFILE_ERROR",
          "REMOVE_TOTP",
          "REMOVE_TOTP_ERROR",
          "GRANT_CONSENT",
          "GRANT_CONSENT_ERROR",
          "UPDATE_CONSENT",
          "UPDATE_CONSENT_ERROR",
          "REVOKE_GRANT",
          "REVOKE_GRANT_ERROR",
          "SEND_VERIFY_EMAIL",
          "SEND_VERIFY_EMAIL_ERROR",
          "SEND_RESET_PASSWORD",
          "SEND_RESET_PASSWORD_ERROR",
          "SEND_IDENTITY_PROVIDER_LINK",
          "SEND_IDENTITY_PROVIDER_LINK_ERROR",
          "RESET_PASSWORD",
          "RESET_PASSWORD_ERROR",
          "RESTART_AUTHENTICATION",
          "RESTART_AUTHENTICATION_ERROR",
          "INVALID_SIGNATURE",
          "INVALID_SIGNATURE_ERROR",
          "REGISTER_NODE",
          "REGISTER_NODE_ERROR",
          "UNREGISTER_NODE",
          "UNREGISTER_NODE_ERROR",
          "USER_INFO_REQUEST",
          "USER_INFO_REQUEST_ERROR",
          "IDENTITY_PROVIDER_LINK_ACCOUNT",
          "IDENTITY_PROVIDER_LINK_ACCOUNT_ERROR",
          "IDENTITY_PROVIDER_LOGIN",
          "IDENTITY_PROVIDER_LOGIN_ERROR",
          "IDENTITY_PROVIDER_FIRST_LOGIN",
          "IDENTITY_PROVIDER_FIRST_LOGIN_ERROR",
          "IDENTITY_PROVIDER_POST_LOGIN",
          "IDENTITY_PROVIDER_POST_LOGIN_ERROR",
          "IDENTITY_PROVIDER_RESPONSE",
          "IDENTITY_PROVIDER_RESPONSE_ERROR",
          "IDENTITY_PROVIDER_RETRIEVE_TOKEN",
          "IDENTITY_PROVIDER_RETRIEVE_TOKEN_ERROR",
          "IMPERSONATE",
          "IMPERSONATE_ERROR",
          "CUSTOM_REQUIRED_ACTION",
          "CUSTOM_REQUIRED_ACTION_ERROR",
          "EXECUTE_ACTIONS",
          "EXECUTE_ACTIONS_ERROR",
          "EXECUTE_ACTION_TOKEN",
          "EXECUTE_ACTION_TOKEN_ERROR",
          "CLIENT_INFO",
          "CLIENT_INFO_ERROR",
          "CLIENT_REGISTER",
          "CLIENT_REGISTER_ERROR",
          "CLIENT_UPDATE",
          "CLIENT_UPDATE_ERROR",
          "CLIENT_DELETE",
          "CLIENT_DELETE_ERROR",
          "CLIENT_INITIATED_ACCOUNT_LINKING",
          "CLIENT_INITIATED_ACCOUNT_LINKING_ERROR",
          "TOKEN_EXCHANGE",
          "TOKEN_EXCHANGE_ERROR",
          "OAUTH2_DEVICE_AUTH",
          "OAUTH2_DEVICE_AUTH_ERROR",
          "OAUTH2_DEVICE_VERIFY_USER_CODE",
          "OAUTH2_DEVICE_VERIFY_USER_CODE_ERROR",
          "OAUTH2_DEVICE_CODE_TO_TOKEN",
          "OAUTH2_DEVICE_CODE_TO_TOKEN_ERROR",
          "AUTHREQID_TO_TOKEN",
          "AUTHREQID_TO_TOKEN_ERROR",
          "PERMISSION_TOKEN",
          "PERMISSION_TOKEN_ERROR",
          "DELETE_ACCOUNT",
          "DELETE_ACCOUNT_ERROR",
          "PUSHED_AUTHORIZATION_REQUEST",
          "PUSHED_AUTHORIZATION_REQUEST_ERROR",
          "USER_DISABLED_BY_PERMANENT_LOCKOUT",
          "USER_DISABLED_BY_PERMANENT_LOCKOUT_ERROR",
          "USER_DISABLED_BY_TEMPORARY_LOCKOUT",
          "USER_DISABLED_BY_TEMPORARY_LOCKOUT_ERROR",
          "OAUTH2_EXTENSION_GRANT",
          "OAUTH2_EXTENSION_GRANT_ERROR",
          "FEDERATED_IDENTITY_OVERRIDE_LINK",
          "FEDERATED_IDENTITY_OVERRIDE_LINK_ERROR",
          "UPDATE_CREDENTIAL",
          "UPDATE_CREDENTIAL_ERROR",
          "REMOVE_CREDENTIAL",
          "REMOVE_CREDENTIAL_ERROR",
          "INVITE_ORG",
          "INVITE_ORG_ERROR",
          "USER_SESSION_DELETED",
          "USER_SESSION_DELETED_ERROR",
          "VERIFIABLE_CREDENTIAL_REQUEST",
          "VERIFIABLE_CREDENTIAL_REQUEST_ERROR",
          "VERIFIABLE_CREDENTIAL_OFFER_REQUEST",
          "VERIFIABLE_CREDENTIAL_OFFER_REQUEST_ERROR",
          "VERIFIABLE_CREDENTIAL_NONCE_REQUEST",
          "VERIFIABLE_CREDENTIAL_NONCE_REQUEST_ERROR",
          "VERIFIABLE_CREDENTIAL_CREATE_OFFER",
          "VERIFIABLE_CREDENTIAL_CREATE_OFFER_ERROR",
          "VERIFIABLE_CREDENTIAL_PRE_AUTHORIZED_GRANT",
          "VERIFIABLE_CREDENTIAL_PRE_AUTHORIZED_GRANT_ERROR",
          "JWT_AUTHORIZATION_GRANT",
          "JWT_AUTHORIZATION_GRANT_ERROR"
        ]
      },
      "allOf": [
        {
          "if": {
            "contains": {
              "const": "*"
            }
          },
          "then": {
            "maxItems": 1
          }
        }
      ]
    },
    "operations": {
      "type": "array",
      "uniqueItems": true,
      "items": {
        "enum": [
          "*",
          "CREATE",
          "UPDATE",
          "DELETE",
          "ACTION"
        ]
      },
      "allOf": [
        {
          "if": {
            "contains": {
              "const": "*"
            }
          },
          "then": {
            "maxItems": 1
          }
        }
      ]
    },
    "resourceType": {
      "anyOf": [
        {
          "enum": [
            "*",
            "REALM",
            "REALM_ROLE",
            "REALM_ROLE_MAPPING",
            "REALM_SCOPE_MAPPING",
            "AUTH_FLOW",
            "AUTH_EXECUTION_FLOW",
            "AUTH_EXECUTION",
            "AUTHENTICATOR_CONFIG",
            "REQUIRED_ACTION_CONFIG",
            "REQUIRED_ACTION",
            "IDENTITY_PROVIDER",
            "IDENTITY_PROVIDER_MAPPER",
            "PROTOCOL_MAPPER",
            "USER",
            "USER_LOGIN_FAILURE",
            "USER_SESSION",
            "USER_FEDERATION_PROVIDER",
            "USER_FEDERATION_MAPPER",
            "GROUP",
            "GROUP_MEMBERSHIP",
            "CLIENT",
            "CLIENT_INITIAL_ACCESS_MODEL",
            "CLIENT_ROLE",
            "CLIENT_ROLE_MAPPING",
            "CLIENT_SCOPE",
            "CLIENT_SCOPE_MAPPING",
            "CLIENT_SCOPE_CLIENT_MAPPING",
            "CLUSTER_NODE",
            "COMPONENT",
            "AUTHORIZATION_RESOURCE_SERVER",
            "AUTHORIZATION_RESOURCE",
            "AUTHORIZATION_SCOPE",
            "AUTHORIZATION_POLICY",
            "CUSTOM",
            "USER_PROFILE",
            "ORGANIZATION",
            "ORGANIZATION_MEMBERSHIP",
            "ORGANIZATION_GROUP",
            "ORGANIZATION_GROUP_MEMBERSHIP"
          ]
        },
        {
          "type": "string",
          "pattern": "^custom:[\\s\\S]*[^\\u0009-\\u000d\\u001c-\\u0020\\u1680\\u2000-\\u2006\\u2008-\\u200a\\u2028\\u2029\\u205f\\u3000][\\s\\S]*$",
          "not": {
            "const": "custom:*"
          }
        }
      ]
    },
    "adminRule": {
      "type": "object",
      "required": [
        "resourceType",
        "operations"
      ],
      "properties": {
        "resourceType": {
          "$ref": "#/$defs/resourceType"
        },
        "operations": {
          "$ref": "#/$defs/operations"
        },
        "userEnabled": {
          "type": "boolean"
        }
      },
      "allOf": [
        {
          "if": {
            "required": [
              "userEnabled"
            ]
          },
          "then": {
            "properties": {
              "resourceType": {
                "enum": [
                  "USER",
                  "custom:USER"
                ]
              },
              "operations": {
                "minItems": 1,
                "items": {
                  "enum": [
                    "CREATE",
                    "UPDATE"
                  ]
                }
              }
            }
          }
        }
      ],
      "additionalProperties": false
    },
    "userMatch": {
      "type": "object",
      "required": [
        "kind",
        "eventTypes"
      ],
      "properties": {
        "kind": {
          "const": "user"
        },
        "eventTypes": {
          "$ref": "#/$defs/eventTypes"
        },
        "realmIds": {
          "$ref": "#/$defs/identifiers"
        },
        "clientIds": {
          "$ref": "#/$defs/identifiers",
          "description": "Public Keycloak client IDs."
        },
        "outcomes": {
          "$ref": "#/$defs/outcomes"
        },
        "subjects": {
          "$ref": "#/$defs/subjects"
        }
      },
      "additionalProperties": false
    },
    "adminMatch": {
      "type": "object",
      "required": [
        "kind",
        "resourceType",
        "operations"
      ],
      "properties": {
        "kind": {
          "const": "admin"
        },
        "resourceType": {
          "$ref": "#/$defs/resourceType"
        },
        "operations": {
          "$ref": "#/$defs/operations"
        },
        "userEnabled": {
          "type": "boolean"
        },
        "realmIds": {
          "$ref": "#/$defs/identifiers"
        },
        "clientIds": {
          "$ref": "#/$defs/identifiers",
          "description": "Public Keycloak client IDs resolved in the admin actor's realm."
        },
        "outcomes": {
          "$ref": "#/$defs/outcomes"
        },
        "subjects": {
          "$ref": "#/$defs/subjects"
        }
      },
      "allOf": [
        {
          "if": {
            "required": [
              "userEnabled"
            ]
          },
          "then": {
            "properties": {
              "resourceType": {
                "enum": [
                  "USER",
                  "custom:USER"
                ]
              },
              "operations": {
                "minItems": 1,
                "items": {
                  "enum": [
                    "CREATE",
                    "UPDATE"
                  ]
                }
              }
            }
          }
        }
      ],
      "additionalProperties": false
    },
    "deliveryRule": {
      "type": "object",
      "required": [
        "id",
        "match",
        "policy"
      ],
      "properties": {
        "id": {
          "type": "string",
          "pattern": "[^\\u0009-\\u000d\\u001c-\\u0020\\u1680\\u2000-\\u2006\\u2008-\\u200a\\u2028\\u2029\\u205f\\u3000]"
        },
        "match": {
          "oneOf": [
            {
              "$ref": "#/$defs/userMatch"
            },
            {
              "$ref": "#/$defs/adminMatch"
            }
          ]
        },
        "policy": {
          "$ref": "#/$defs/policy"
        }
      },
      "additionalProperties": false
    },
    "policy": {
      "type": "object",
      "required": [
        "action"
      ],
      "properties": {
        "action": {
          "enum": [
            "retry",
            "discard"
          ]
        },
        "maxAgeSeconds": {
          "type": "integer",
          "minimum": 1,
          "maximum": 31536000
        },
        "maxFailures": {
          "type": "integer",
          "minimum": 1,
          "maximum": 1000000
        }
      },
      "allOf": [
        {
          "if": {
            "properties": {
              "action": {
                "const": "retry"
              }
            }
          },
          "then": {
            "not": {
              "anyOf": [
                {
                  "required": [
                    "maxAgeSeconds"
                  ]
                },
                {
                  "required": [
                    "maxFailures"
                  ]
                }
              ]
            }
          },
          "else": {
            "anyOf": [
              {
                "required": [
                  "maxAgeSeconds"
                ]
              },
              {
                "required": [
                  "maxFailures"
                ]
              }
            ]
          }
        }
      ],
      "additionalProperties": false
    }
  }
}
